[
  {
    "id": "VOX.STATUS",
    "command": "STATUS",
    "class": "OBSERVE",
    "purpose": "Query and report the current operational status, subsystem metrics, or health of a designated target.",
    "canonical_forms": [
      "STATUS"
    ],
    "aliases": [
      "give me status",
      "what's the system status",
      "system status",
      "report status",
      "check health",
      "operational status"
    ],
    "parameters": {
      "target": {
        "required": false,
        "type": "string",
        "description": "Subsystem or target resource to query. Defaults to system."
      }
    },
    "examples": [
      "Status",
      "Give me status",
      "What's the system status",
      "Report propulsion status"
    ],
    "authority": {
      "system": "AUTHPACK",
      "required": "Requires AUTHPACK authorization for reading system or subsystem status."
    },
    "confirmation": false,
    "execution": "Queries telemetry and system metrics through the workstation execution layer.",
    "failure": "Report telemetry acquisition failure through COMMPACK.",
    "escalation": "None.",
    "response_profile": "COMMPACK.STATUS"
  },
  {
    "id": "VOX.HELP",
    "command": "HELP",
    "class": "OBSERVE",
    "purpose": "Provide operator guidance, available commands, or operational assistance for the active interface.",
    "canonical_forms": [
      "HELP"
    ],
    "aliases": [
      "assist",
      "assistance",
      "what can i say",
      "list commands",
      "command guide"
    ],
    "parameters": {
      "query": {
        "required": false,
        "type": "string",
        "description": "Specific topic or command to get help on."
      }
    },
    "examples": [
      "Help",
      "What can I say",
      "Command guide"
    ],
    "authority": {
      "system": "AUTHPACK",
      "required": "Requires AUTHPACK authorization for public knowledge retrieval."
    },
    "confirmation": false,
    "execution": "Presents operator documentation and voice command guidance.",
    "failure": "Report guidance unavailable.",
    "escalation": "None.",
    "response_profile": "COMMPACK.INFO"
  },
  {
    "id": "VOX.LIST",
    "command": "LIST",
    "class": "OBSERVE",
    "purpose": "Enumerate available resources, files, surfaces, or inventory items in the specified scope.",
    "canonical_forms": [
      "LIST"
    ],
    "aliases": [
      "enumerate",
      "show all",
      "list files",
      "list resources"
    ],
    "parameters": {
      "resource": {
        "required": false,
        "type": "string",
        "description": "Category or scope of resources to list."
      }
    },
    "examples": [
      "List resources",
      "Enumerate files",
      "Show all surfaces"
    ],
    "authority": {
      "system": "AUTHPACK",
      "required": "Requires AUTHPACK read authorization for the designated resource scope."
    },
    "confirmation": false,
    "execution": "Queries directory or resource index.",
    "failure": "Report index retrieval failure.",
    "escalation": "None.",
    "response_profile": "COMMPACK.STATUS"
  },
  {
    "id": "VOX.SHOW",
    "command": "SHOW",
    "class": "OBSERVE",
    "purpose": "Display or visually present a designated metric, chart, node, or surface component.",
    "canonical_forms": [
      "SHOW"
    ],
    "aliases": [
      "display",
      "view",
      "reveal"
    ],
    "parameters": {
      "target": {
        "required": true,
        "type": "string",
        "description": "The element, node, or metric to display."
      }
    },
    "examples": [
      "Show telemetry",
      "Display warp core",
      "View impulse manifold"
    ],
    "authority": {
      "system": "AUTHPACK",
      "required": "Requires AUTHPACK read authorization for the visual target."
    },
    "confirmation": false,
    "execution": "Activates visualization or focuses the visual container.",
    "failure": "Report target not found.",
    "escalation": "None.",
    "response_profile": "COMMPACK.ACTION"
  },
  {
    "id": "VOX.READ",
    "command": "READ",
    "class": "OBSERVE",
    "purpose": "Read aloud or synthesize textual content, telemetry log entries, or diagnostic briefs.",
    "canonical_forms": [
      "READ"
    ],
    "aliases": [
      "read out",
      "speak",
      "vocalize"
    ],
    "parameters": {
      "target": {
        "required": true,
        "type": "string",
        "description": "The text, file, or log stream to read."
      }
    },
    "examples": [
      "Read log entries",
      "Read telemetry",
      "Speak latest advisory"
    ],
    "authority": {
      "system": "AUTHPACK",
      "required": "Requires AUTHPACK authorization to access the text stream."
    },
    "confirmation": false,
    "execution": "Submits textual stream to speech synthesis engine.",
    "failure": "Report audio synthesis failure.",
    "escalation": "None.",
    "response_profile": "COMMPACK.INFO"
  },
  {
    "id": "VOX.SEARCH",
    "command": "SEARCH",
    "class": "OBSERVE",
    "purpose": "Search knowledge bases, logs, or file systems for matches corresponding to a query.",
    "canonical_forms": [
      "SEARCH"
    ],
    "aliases": [
      "look for",
      "query",
      "locate"
    ],
    "parameters": {
      "query": {
        "required": true,
        "type": "string",
        "description": "Search text or pattern."
      },
      "location": {
        "required": false,
        "type": "string",
        "description": "Scope or repository to search."
      }
    },
    "examples": [
      "Search logs for anomaly",
      "Query reactor specifications"
    ],
    "authority": {
      "system": "AUTHPACK",
      "required": "Requires AUTHPACK search authorization."
    },
    "confirmation": false,
    "execution": "Executes retrieval search against indexing layer.",
    "failure": "Report query execution failure.",
    "escalation": "None.",
    "response_profile": "COMMPACK.STATUS"
  },
  {
    "id": "VOX.FIND",
    "command": "FIND",
    "class": "OBSERVE",
    "purpose": "Locate a specific unique resource, node, or file.",
    "canonical_forms": [
      "FIND"
    ],
    "aliases": [
      "pinpoint",
      "track down"
    ],
    "parameters": {
      "item": {
        "required": true,
        "type": "string",
        "description": "The specific item to locate."
      }
    },
    "examples": [
      "Find primary reactor",
      "Find navigation manifest"
    ],
    "authority": {
      "system": "AUTHPACK",
      "required": "Requires AUTHPACK read authorization."
    },
    "confirmation": false,
    "execution": "Locates item and selects coordinate or node reference.",
    "failure": "Report item not found.",
    "escalation": "None.",
    "response_profile": "COMMPACK.ACTION"
  },
  {
    "id": "VOX.OPEN",
    "command": "OPEN",
    "class": "NAVIGATE",
    "purpose": "Open an authorized application, file, surface, resource, or workspace.",
    "canonical_forms": [
      "OPEN"
    ],
    "aliases": [
      "launch",
      "bring up",
      "pull up",
      "navigate to",
      "switch to"
    ],
    "parameters": {
      "target": {
        "required": true,
        "type": "string",
        "description": "Name or identifier of target surface, application, or file."
      },
      "location": {
        "required": false,
        "type": "string",
        "description": "Target workspace or screen area."
      }
    },
    "examples": [
      "Open the RAG browser",
      "Launch VS Code",
      "Bring up the MythOS dashboard",
      "Pull up the dashboard",
      "Switch to voice control"
    ],
    "authority": {
      "system": "AUTHPACK",
      "required": "Requires AUTHPACK authorization for the requested target."
    },
    "confirmation": false,
    "execution": "Submit the normalized navigation request to the workstation execution layer.",
    "failure": "Report actual failure condition or missing target.",
    "escalation": "Escalate when requested operation exceeds available authority.",
    "response_profile": "COMMPACK.ACTION"
  },
  {
    "id": "VOX.CLOSE",
    "command": "CLOSE",
    "class": "NAVIGATE",
    "purpose": "Close or dismiss the specified active window, modal, surface, or panel.",
    "canonical_forms": [
      "CLOSE"
    ],
    "aliases": [
      "dismiss",
      "shut down",
      "exit",
      "hide"
    ],
    "parameters": {
      "target": {
        "required": true,
        "type": "string",
        "description": "The surface, modal, or window to close."
      }
    },
    "examples": [
      "Close modal",
      "Dismiss diagnostics",
      "Hide telemetry"
    ],
    "authority": {
      "system": "AUTHPACK",
      "required": "Requires AUTHPACK window management authorization."
    },
    "confirmation": false,
    "execution": "Sends close event to the window or panel controller.",
    "failure": "Report inability to dismiss window.",
    "escalation": "None.",
    "response_profile": "COMMPACK.ACTION"
  },
  {
    "id": "VOX.SELECT",
    "command": "SELECT",
    "class": "NAVIGATE",
    "purpose": "Choose or highlight a specific node, item, or entry in a collection.",
    "canonical_forms": [
      "SELECT"
    ],
    "aliases": [
      "choose",
      "pick",
      "highlight"
    ],
    "parameters": {
      "item": {
        "required": true,
        "type": "string",
        "description": "The item or node key to select."
      }
    },
    "examples": [
      "Select primary coil",
      "Choose profile two"
    ],
    "authority": {
      "system": "AUTHPACK",
      "required": "Requires AUTHPACK interaction authorization."
    },
    "confirmation": false,
    "execution": "Sets active selection state in the component model.",
    "failure": "Report target item not found.",
    "escalation": "None.",
    "response_profile": "COMMPACK.ACTION"
  },
  {
    "id": "VOX.FOCUS",
    "command": "FOCUS",
    "class": "NAVIGATE",